<?xml version="1.0"?>

<projectlist xmlns:xsi="http://www.w3.org/2001/XMLSchema-instance"
xsi:noNamespaceSchemaLocation="projectlist_1_2_0.xsd">
  <description>Standard Projects</description>

  <project>
    <name>checkstyle</name>
    <type>git</type>
    <connection>https://github.com/checkstyle/checkstyle</connection>
    <tag>checkstyle-8.10</tag>
    <exclude-pattern>**/src/test/resources-noncompilable/**/*</exclude-pattern>
    <exclude-pattern>**/src/test/resources/**/*</exclude-pattern>
  </project>

<!-- The base pmd_releases_6.6.0-baseline.zip contains also spring-framework
     which is skipped in that integration test -->
<!--
  <project>
    <name>spring-framework</name>
    <type>git</type>
    <connection>https://github.com/spring-projects/spring-framework</connection>
    <tag>v5.0.6.RELEASE</tag>
  </project>
-->
</projectlist>
