<?xml version="1.0"?>

<projectlist xmlns:xsi="http://www.w3.org/2001/XMLSchema-instance"
xsi:noNamespaceSchemaLocation="projectlist_1_2_0.xsd">
  <description>Standard Projects</description>

  <project>
    <name>checkstyle</name>
    <type>git</type>
    <connection>https://github.com/checkstyle/checkstyle</connection>
    <tag>checkstyle-9.1</tag>

    <exclude-pattern>.*/target/test-classes/com/puppycrawl/tools/checkstyle/.*</exclude-pattern>
    <exclude-pattern>.*/target/generated-sources/.*</exclude-pattern>
    <exclude-pattern>.*/src/test/resources-noncompilable/com/puppycrawl/tools/checkstyle/javaparser/InputJavaParserNoFreezeOnDeeplyNestedLambdas.java</exclude-pattern>

    <build-command><![CDATA[#!/usr/bin/env bash
if test -e classpath.txt; then
  exit
fi

set -e

# Make sure to use java11. This is already installed by setup-java.
export JAVA_HOME=${HOME}/openjdk11
export PATH=$JAVA_HOME/bin:$PATH

mvn test-compile -B
mvn dependency:build-classpath -DincludeScope=test -Dmdep.outputFile=classpath.txt -B
]]></build-command>
    <auxclasspath-command>echo -n "$(pwd)/target/classes:$(pwd)/target/test-classes:"; cat classpath.txt</auxclasspath-command>
  </project>

<!-- The base pmd_releases_6.40.0-baseline.zip contains also spring-framework
     which is skipped in that integration test -->
<!--
  <project>
    <name>spring-framework</name>
    <type>git</type>
    <connection>https://github.com/spring-projects/spring-framework</connection>
    <tag>v5.3.13</tag>
  </project>
-->

<!-- The base pmd_releases_6.40.0-baseline.zip does not contain Schedul-o-matic-9000.
     All the found violation will appear as new. -->
  <project>
    <name>Schedul-o-matic-9000</name>
    <type>git</type>
    <connection>https://github.com/SalesforceLabs/Schedul-o-matic-9000</connection>
    <tag>6b1229ba43b38931fbbab5924bc9b9611d19a786</tag>
  </project>

</projectlist>
