<?xml version="1.0"?>

<projectlist xmlns:xsi="http://www.w3.org/2001/XMLSchema-instance"
xsi:noNamespaceSchemaLocation="projectlist_1_2_0.xsd">
  <description>Standard Projects</description>

  <project>
    <name>checkstyle</name>
    <type>git</type>
    <connection>https://github.com/checkstyle/checkstyle</connection>
    <tag>checkstyle-8.10</tag>
    <exclude-pattern>**/src/test/resources-noncompilable/**/*</exclude-pattern>
    <exclude-pattern>**/src/test/resources/**/*</exclude-pattern>
    <build-command>mvn test-compile -B</build-command>
    <auxclasspath-command>echo -n "$(pwd)/target/classes:"</auxclasspath-command>
  </project>

  <project>
    <name>openjdk10</name>
    <type>hg</type>
    <connection>http://hg.openjdk.java.net/jdk10/jdk10/jdk</connection>
    <webview-url>http://hg.openjdk.java.net/jdk10/jdk10/jdk/file/777356696811</webview-url>
  </project>

  <project>
    <name>spring-framework</name>
    <type>git</type>
    <connection>https://github.com/spring-projects/spring-framework</connection>
    <webview-url>https://github.com/spring-projects/spring-framework/tree/v5.0.6.RELEASE</webview-url>
    <tag>v5.0.6.RELEASE</tag>
  </project>

</projectlist>
