<?xml version="1.0"?>

<projectlist xmlns:xsi="http://www.w3.org/2001/XMLSchema-instance"
xsi:noNamespaceSchemaLocation="projectlist_1_2_0.xsd">
  <description>Standard Projects</description>

  <project>
    <name>Schedul-o-matic-9000</name>
    <type>git</type>
    <connection>https://github.com/SalesforceLabs/Schedul-o-matic-9000</connection>
    <tag>6b1229ba43b38931fbbab5924bc9b9611d19a786</tag>
  </project>

  <project>
    <name>fflib-apex-common</name>
    <type>git</type>
    <connection>https://github.com/apex-enterprise-patterns/fflib-apex-common</connection>
    <tag>7e0891efb86d23de62811af56d87d0959082a322</tag>
  </project>

</projectlist>
